complete_name	location	legislation	network	year_established	core_area_ha	buffer_area_ha
Biatongan Reef Fish Sanctuary	null Calbayog City Samar	Municipal Ordinance Mun. Ord. (specific number not obtained)	null	1996	14.6	0
Minalulan Shell and Fish Sanctuary	Minalulan Maria Siquijor	Municipal Ordinance Brgy. Res., Mun Ord  04-2003	null	2003	14.63	0
Kingfisher Fishery Reserve	Tiguihan Pola Oriental Mindoro	Municipal Ordinance No. 2014-05	null	2013	14.66	33
Pong-oy Marine Reserve	Pong-Oy San Juan Southern Leyte	NA	null	2012	14.66	0
Lio Reef (Brgy. Lio)	null Romblon Romblon	NA	null	0	14.727	0
Brgy Johnson Island Marine Protected Area (BJIMPA)	null Roxas Palawan	Barangay Resolution No.3 Series of 2007; Mun. Ordinance No. 339, S-2007	null	2007	14.76	1514.76
Tumakin Gamay Og Tunakin Dako Marine Sanctuary	Conalum Inopacan Leyte	Resolution Mun. Res. No. 134-1996	null	1996	14.8	0
Magsaysay MPA	Tondol Anda Pangasinan	Municipal Ordinance MO# 1-2001	null	2001	14.8	0
Tondol MPA	Tondol Anda Pangasinan	Municipal Ordinance MO# 01-2001	null	2001	14.8	0
Burias Shoal	Molugan El Salvador Misamis Oriental	City Fishery Code of 2012	null	2015	14.8	0
Gilutongan Island Marine Sanctuary & TZMR	null Cordoba Cebu	Combination PP# 1801, MR# 83-91, MO# 91-83, amended MO# 3-1999	null	1999	14.89	0
Baybay Kawas Fish Sanctuary	Kawas Alabel Sarangani	Municipal Ordinance 99-15	null	1999	15	0
Awaan Marine Sanctuary	Awa-An Ayungon Negros Oriental	Municipal Ordinance Mun Ord  10 & 11-2005	null	2005	15	0
San Antonio Marine Sanctuary	San Antonio Duero Bohol	Municipal Ordinance Mun Ord  02-2002	null	2002	15	0
Tarong Fish Sanctuary Marine Park and Fishery Reserve	null Madridejos Cebu	Municipal Ordinance MO# 1-s-2003	null	2003	15	0
Alabel Fish Sanctuary	Kawas Alabel Sarangani	Municipal Ordinance 99-15	null	1999	15	0
Langub Marine Sanctuary	null Santa Fe Cebu	BO No. 04 s of 2009	Langub MPA Ordinance	null	2007	15	0
Sagasa Marine Sanctuary	Sagasa Bien Unido Bohol	Municipal Ordinance Mun Ord 02-2002	null	2002	15	0
Cawayan Fish Sanctuary	null San Francisco Quezon	Municipal Ordinance MO	null	2002	15	0
Buenavista Fish Sanctuary	Buenavista Padre Burgos Southern Leyte	Municipal Ordinance Res. No. 045-2005  Ord. No. 2005-005	null	2005	15	0
Cabulijan Marine Sanctuary	Cabulihan Tubigon Bohol	Municipal Ordinance Mun Ord 2000-07-167(Tubigon CRM Code of 2000)	null	2002	15	0
Cabulotan Marine Reserve	Cabulotan Tayasan Negros Oriental	Municipal Ordinance Mun. Res. No. 05-1993	null	1993	15	0
Paroyhog FS	null Santa Maria Romblon	NA	null	2002	15	0
Benolho Fish Sanctuary	null Albuera Leyte	Municipal Ordinance Mun Ord  2003-18	null	1993	15	0
Minalongan Island Fish Sanctuary and Breeding Area	null null Eastern Samar	NA	null	0	15	0
Matutinao Marine Sanctuary	Matutinao Badian Cebu	Municipal Ordinance Mun Ord  09-2003	null	2003	15	0
Talahid, San Pedro Mud Crab Breeding Station	null Panganiban Catanduanes	NA	null	0	15	0
Anibong Marine Reserve	null Ayungon Negros Oriental	Resolution # 19, Unified Ordinance 03, S. 2008	null	2008	15	0
Burias Marine Protected Area	La Union San Isidro Davao Oriental	MO # 117	Davao Gulf Marine Protected Area Network Plan	1996	15	0
Poblacion Marine Protected Area	Poblacion Alcoy Cebu	Municipal Ordinance #85 - 2006	null	2006	15	0
Tagcatong Fish Sanctuary	Tagcatong Carmen Agusan del Norte	Municipal Fisheries Ordinance no.5 series of 2003	null	2003	15	0
Bagongbayan Fish Sanctuary and Fishery Reserve	null null null	Municipal Ordinance No. 09-03	null	2009	15	10
Bagongbayan Fish Sanctuary and Fishery Reserve	null null null	Municipal Ordinance No. 09-03	null	2009	15	10
Bagongbayan Fish Sanctuary and Fishery Reserve	null null null	Municipal Ordinance No. 09-03	null	2009	15	10
Bagongbayan Fish Sanctuary and Fishery Reserve	null null null	Municipal Ordinance No. 09-03	null	2009	15	10
Agnay Reef	null Romblon Romblon	NA	null	0	15.08	0
Tiguib Marine Reserve	null Ayungon Negros Oriental	Municipal Ordinance Mun Ord  10 & 11-2005	null	2005	15.14	0
Pangdan Marine Sanctuary	null null null	Mun. Ord. No. 9-09-2007	null	2001	15.2	0
Bancasan Fish and Marine Sanctuary	Bancasan San Remigio Cebu	Municipal Ordinance Mun Ord  32-2002	null	2002	15.25	0
Okoy Marine Reserve	Okoy Santa Fe Cebu	Municipal Ordinance Mun. Ord. No. 02-2004	null	2004	15.27	0
Nagubat Marine Fish Sanctuary	Alambique Gigaquit Surigao Del Norte	mun.ord. #65 s.2009 An ordinance establishing Gigaguit MPA at Sitio Nagubat Island, Alambigue, Gigaguit.	null	2009	15.29	0
San Nicolas MPA	null null null	MO 480 s014



**with other coral reef zone	null	2014	15.31	1162.85
Taradungan MPA	null null null	MO 480 s2014	null	2014	15.31	1162.85
Sillon Marine Sanctuary	Sillon Bantayan Cebu	Municipal Ordinance Municipality Ordinance No. 08-1999 (to be amended)	null	2006	15.36	0
Cathedral Rock Marine Sanctuary	null Mabini Batangas	MO 11-91 amended in 1993, MO 04-2006 amended in 2006	null	1991	15.39	0
Manga Fish Sanctuary	Manga Tagbilaran City Bohol	Municipal Ordinance City Ord.No. C-088-2001	null	2001	15.45	0
Daan Lungsod Marine Sanctuary	null Tuburan Cebu	Municipal Ordinance Municipal Ordinance (not specified)	null	2000	15.48	0
Calag-itan Fish Sanctuary	Calag-Itan Hinunangan Southern Leyte	Municipal Ordiance No. 2000-289	null	2000	15.5	0
Tabalong Marine Sanctuary	null Dauis Bohol	Municipal Ordinance Mun. Ord. No. 07 Series 2005	null	2003	15.52	0
Anas Fish Sanctuary	null Valencia Bohol	Municipal Ordinance Mun Ord  86-2003	null	2003	15.62	0
Nahawan Seagrass Sanctuary	Nahawan Clarin Bohol	Municipal Ordinance No. 08 Series of 2002;

Municipal Ordinance No. 04 series of 2011	null	2002	15.83	0
Barili Marine Protected Area	Japitan Barili Cebu   / Candugay Barili Cebu	Municipal Ordinance Mun Ord  03-2001; Mun Ord  02-1995	null	2001	15.9	0
Song-On Fish Refuge and Sanctuary	null Loon Bohol	Municipal Ordinance Mun Ord 011-1999; Mun Ord  02-007-2002	null	1999	15.99	0
Plaridel Marine Sanctuary	null Baybay Leyte	Municipal Ordinance Mun. Ord.(specific number not obtained)	null	2005	16	0
Motiong Fish Sanctuary	null Motiong Samar	Municipal Ordinance Mun. Ord. (specific number not obtained)	null	1998	16	0
Pondol Marine Sanctuary	null Loon Bohol	Municipal Ordinance Mun Ord (number not specified)	null	0	16	0
Inanuran Islet Wilderness Area	null Tubigon Bohol	Proclamation PP# 2151	null	0	16	0
Taisao Rocks Fish Sanctuary	null Jiabong Samar	Municipal Ordinance Mun. Ord. (specific number not obtained)	null	0	16	0
Libertad Marine Sanctuary	Libertad Nabas Aklan	Municipal Order 2006-09	null	2006	16	0
Sudmon Fish Sanctuary	Sudmon Silago Southern Leyte	Municipal Ordinance No. 2003-01	null	2003	16	0
Kodia Marine Protected Area	Kodia Madridejos Cebu	NA	null	2016	16.17	5.2
Cantagay Marine Sanctuary	Cantagay Jagna Bohol	Municipal Ordinance Mun Ord  9-09-2007; Mun Ord  6-09-2001	null	2002	16.21	0
Balcon Marine Protected Area for Marine Life	null null null	Municipal Ordinance 2012-005	null	2012	16.25	0
Nalayag Point Fishery Refuge and Sanctuary	San Agustin Kanluran, Isla Verde Batangas City Batangas	Ordinance No. 13 S 2007, amended Ord. No. 13 S 2002	null	2002	16.26	0
Baol Island Marine Reserve	null Salcedo Eastern Samar	Municipal Ordinance Mun Ord  05-02-2005 approved by Res. No. 162-2005	null	2006	16.32	0
Masaguing Fish Sanctuary	Masaguing Naujan Oriental Mindoro	MPA Ordinance No.61-2011	Oriental Mindoro Marine Protected Area And Fishery Law Enforcement Network (Ommpafle Network)	2010	16.39	0
Ranzo Fish Sanctuary	null Pinamalayan Oriental Mindoro	Resolution No. 020-2005

MPA Ordinance No. 02-2005                  

Municipal Fishery Ordinance of Pinamalayan 02-2010	Oriental Mindoro Marine Protected Area And Fishery Law Enforcement Network (Ommpafle Network)	2006	16.39	0
Canigaran Fish Sanctuary	null Mercedes Eastern Samar	Ordinance No. 1, Series of 1998; amending Ordinance No. 11, Series of 1995	null	1998	16.47	1
Kan-ugaw Reef (Logbon Is.)	null Romblon Romblon	NA	null	0	16.596	0
Poblacion Fishery Reserve, Refuge and Sanctuary	Poblacion Santa Fe Cebu	BO No. 01 s of 2008	Poblacion MPA Ordinance	null	2008	16.6	0
Medano White Island Marine Fish Sanctuary	null Mambajao Camiguin	NA	null	2000	16.67	0
Brgy. Kuguita Marine/Fish Sanctuary	null Mambajao Camiguin	NA	null	2005	16.67	0
Biri-Magtutuka Island Fish Sanctuary	null Biri Northern Samar	Municipal Ordinance Mun Ord  02-2005	null	2002	16.69	0
Sawang-Olo Olo Fish Sanctuary and Refuge	Sawang Lobo Batangas   / Olo-Olo Lobo Batangas	(SB) Reso 2001-59 adopted by Brgy. Reso.2001-08 Ordinance # 02-2002	Batangas Marine Protected Area And Bantay Dagat Network	2001	16.74	0
Barra Fish Sanctuary	null Lucena City Quezon	Municipal Ordinance MO	null	2003	16.75	0
Casimon Marine Sanctuary	null Tabuelan Cebu	Municipal Ordinance Municipal Ordinance # 07-2001 series of 2001	null	2001	17	0
Tampocon I Marine Reserve	Tampocon I Ayungon Negros Oriental	Municipal Ordinance  Nos. 10 & 11 Series of 2005

Municipal Ordinance No. 03 Series of 2008	null	2005	17	0
Tres Islas Marine Sanctuary	null Inopacan Leyte	Municipal Ordinance Mu. Ord. No. 63-1994; brgy. Res. No. 01-1994; Brgy Ord. No.-1994	null	1994	17	0
Arnedo Marine Sanctuary	Arnedo Bolinao Pangasinan	Municipal Fisheries Ordinance No. 01, Series of 1999; Resolution # 2005 - 55	null	1999	17	1
Antol Fish Sanctuary	null Palompon Leyte	Municipal Ordinance Mun Ord  1 S 2006; Res. No. 15 S 2006	null	2006	17	0
Lipasana Fish Sanctuary	null Narra Palawan	Municipal Ordinance No. 159, 2005	null	2005	17.051	0
Batad Marine Reserve	null Batad Iloilo	Municipal Ordinance Mun Ord  03-27	null	2001	17.23	0
Busalian Marine Protected Area	Busalian Talibon Bohol	Mun Ord No. 2007-02	null	2007	17.39	0
Talisay Fish Sanctuary	Talisay Calape Bohol	Municipal Ordinance MO# 91-033, MO# 09-s-2003 (size amended from 9 has.?)	null	1995	17.45	0
Mabini Fish Sanctuary	null Naval Biliran	NA	null	1995	17.5	0
Caringo Fish Sanctuary	Caringo Mercedes Camarines Norte	An Ordinance Amending Sec.3,6,7 of Municipal Ordinance. No. 100-2002	null	2002	17.703	1
Cantumangpad Marine Sanctuary and Reserve	null Giporlos Eastern Samar	Municipal Ordinance Mun. Ord. (specific number not obtained)	null	1990	17.72	0
Pt. Dapog to Pt. Gigoso Fish Breeding Sanctuary	null Giporlos Eastern Samar	Municipal Ordinance MO# 27	null	1991	17.72	0
Mandalukon Marine Reserve	Coticot Giporlos Eastern Samar	Municipal Ordinance Mun Ord  13-1995; Mun Ord  27-1991; Mun. res. Nos. 06 & 57-1996	null	1995	17.72	0
Independencia Fish Sanctuary	null Talalora Samar	Municipal Ordinance Mun. Ord. (specific number not obtained)	null	1998	17.8	0
Puerto Galera Mangrove Conservation and Ecotourism Area	Dulangan Puerto Galera Oriental Mindoro   / Tabinay Puerto Galera Oriental Mindoro	Municipal Ordinance No.001-2015	null	2015	17.8	0
Arthur's Rock Marine Sanctuary	null Mabini Batangas	MO 11-91 amended in 1993, MO 04-2006 amended in 2006	null	1991	17.98	0
Santiago Marine Protected Area	Santiago San Francisco Cebu	Municipal Ordinance No. 4 Series of 2005	null	2006	18	1
Mawodpawod Fish Sanctuary	null San Miguel Leyte	NA	null	0	18	0
Cabungan Fish Sanctuary	null Anda Pangasinan	Municipal Ordinance No. 02-99, Series 1999	null	1999	18	0
Malbago Fish Sanctuary	null Madridejos Cebu	Municipal Ordinance Mun Ord  001-2002	null	2002	18	0
Tayong Oriental Marine Sanctuary	null Loay Bohol	Municipal Ordinance Mun Ord  0-2002	null	2003	18	0
Calumbuyan (Sogod) Fish Sanctuary	null Sogod Cebu	NA	null	1996	18	0
Mansalay (B. Del Mundo) Fish Sanctuary	null Mansalay Oriental Mindoro	NA	Oriental Mindoro Marine Protected Area And Fishery Law Enforcement Network (Ommpafle Network)	2007	18	0
Malabugas Lampirong Reserve	null Bayawan Negros Oriental	Municipal Ordinance Res. No. No. 663; City Ord. No. 40	null	2003	18	0
Pontoron Reef Fish Sanctuary	null Maigo Lanao Del Norte	Municipal Ordinance MO# 01-2001	null	2001	18	0
Libertad Fish Sanctuary	null Naval Biliran	NA	null	1995	18	0
Bonbon Island Marine Sanctuary	null Caluya Antique	NA	null	2000	18	0
Pasil (Kawasihan) Reef Marine Sanctuary	null Candijay Bohol	Municipal Ordinance Mun Ord  09-2001	null	2001	18	0
Islands of Majaba & Napayauan	null Aroroy Masbate	Proclamation PP# 2151 & PP# 225229	null	0	18	0
Basdio Marine Sanctuary	Basdio Guindulman Bohol	Municipal Ordinance Mun Ord  02-2008; Brgy. Res. No. 12-176-2001,MR# 2001-10-122	null	2002	18.04	0
Sabang Fish Sanctuary	Sabang Hinundayan Southern Leyte	Municipal Ordinance No. 2000-33	null	2000	18.13	0
Kapid Reef Sanctuary	null Narra Palawan	Municipal Ordinance No. 159, 2005	null	2005	18.144	0
Quinapaguian Fish Sanctuary	Quinapaguian Mercedes Camarines Norte	Mun. Ord.100-2002	null	2002	18.27	1
Bacuag Marine Protected Area	Poblacion Bacuag Surigao Del Norte	Municipal Ordinance No. 005 Series of 2007	null	2007	18.42	0
Bilasonan Og Bitaong Marine Sanctuary	Maljo Inopacan Leyte   / Esperanza Inopacan Leyte	Resolution Mun. Res. No. 134-1996	null	1996	18.5	0
Magay Marine Sanctuary	null Compostela Cebu	Municipal Ordinance MO# 8-s-2005	null	2005	18.5	0
Pulang Yuta Marine Sanctuary	Puangyuta Dimiao Bohol	Municipal Ordinance Mun Ord  8-2001	null	2001	18.55	0
Vinapor Fish Sanctuary	Vinapor Carmen Agusan del Norte	Municipal Fisheries Ordinance no.5 series of 2003	null	2003	18.57	0
Santiago Marine Sanctuary	null San Francisco Cebu	Municipal Ordinance MO# 2006-043	null	2006	18.592	0
Magtongtong Fish Sanctuary	Magtongtong Calape Bohol	Municipal Ordinance No. 96-05-1996;

Prov. Res. No. 497 Series1996;

Municipal Ordinance 15-2003; R.A. 7586	null	1996	18.62	0
Bantigue Island Marine Sanctuary	null Pres. Carlos P. Garcia Bohol	Municipal Ordinance MO# 10-054; 

Municipal Ordinance C-004-2006	null	2005	18.9	0
Centro Marine Sanctuary	Centro Tubigon Bohol	Municipal Ordinance Mun Ord 2000-07-167 (Tubigon CRM Code of 2000)	null	2005	19	0
San Miguel Fish Sanctuary	null San Miguel Leyte	Municipal Ordinance MO., BR. #2 & BFAR AO	null	0	19	0
Barugo Fish Sanctuary	null Barugo Leyte	Municipal Ordinance MO# 72, FAO# 180	null	1991	19	0
Budlanan Island Wilderness Area	null Tubigon Bohol	Proclamation PP# 2151 & PP# 225229	null	0	19	0
Agoho Marine Fish Sanctuary	null Mambajao Camiguin	NA	null	2000	19	0
Panga Wilderness Area	null Inabanga Bohol	Proclamation PP# 2151 & PP# 225229	null	0	19	0
Lagoma Fish Sanctuary	Laguma Silago Southern Leyte	Municipal Ordinance No. 2000-01	null	2000	19	0
Poblacion Fish Sanctuary	Poblacion Bacolod Bacolod Lanao Del Norte	Comprehensive Municipal Fisheries Ordinance 2007	null	2007	19	0
Maasin Fish Sanctuary	Maasin Bulalacao Oriental Mindoro	MPA Ordinance No. 15-02-144	Oriental Mindoro Marine Protected Area And Fishery Law Enforcement Network (Ommpafle Network)	2014	19.06	0
Minombonan Reef and Fish Sanctuary	Camanga Salcedo Eastern Samar	Municipal Ordinance Mun Ord  02-1996; Mun Ord  04-1994	null	1996	19.2	0
Binangalan Reef Fish Sanctuary	null Palo Leyte	Municipal Ordinance Mun. Ord. 2006-08	null	2006	19.2	0
Jovellar MPA	null Tarragona Davao Oriental	NA	null	0	19.4	0
Mahaba Island Mangrove Swamp Forest Reserve /Fish Sanctuary	null Hinatuan Surigao Del Sur	Proclamation No. 2152, s.1981	null	1999	19.5	0
Kabaisan Marine Protected Area	null San Isidro Davao Oriental	MO # 2217

*year established to be verified	Davao Gulf Marine Protected Area Network Plan	2012	19.67	0
Chavayan Marine Protected Area	Chavayan Sabtang Batanes	aaa	null	0	19.698	0
Kantabugon Marine Protected Area	null Aloguinsan Cebu	MO No. 02 s of 2005	Marine Sanctuary Regulations Ordinance

MO No. 01 s of 2005	MPA Ordinance

MO No. 01 s of 2013	Bonbon Marine Sanctuary Ordinance

MO No. 02 s of 1999	Coastal and Fisheries Management Ordinance	null	2007	19.719	0
Pandong Bato Marine Sanctuary (Brgy. Puente)	null Carmen Cebu	Municipal Ordinance MO# 6-2006, Res No. 2006-195	null	1997	19.8	0
Liloan Marine Sanctuary	Tabugon Liloan Southern Leyte	Municipal Ordinance No. 1993-16	null	1993	19.8	0
Cataban Fish Sanctuary	null Talibon Bohol	Municipal Ordinance No. 96-54 Series 1996;

Municipal Ordinance No. C-004	null	1996	19.85	0
Antipuluan-Taritien Fish Sanctuary	null Narra Palawan	Municipal Ordinance No. 159, 2005	null	2005	19.954	0
Magallanes Municipal Fish/ Marine Sanctuary	Biga Magallanes Sorsogon	Municipal Ordinance No.287-2002	null	2002	20	21
Bolusao Fish Sanctuary	Bolusao Lawaan Eastern Samar	Mun. Fishery Ord. No. 03-2003	null	2000	20	1
Bolusao Fish Sanctuary	Bolusao Lawaan Eastern Samar	BRGY. ORDINANCE IS ON PROCESS BUT A PO RESOLUTION NO. 01, SERIES OF 2013 WAS MADE AND LOBBIED TO THE BRGY. FOR ADOPTION	null	2000	20	1
Bolusao Fish Sanctuary	Bolusao Lawaan Eastern Samar	Mun. Fishery Ord. No. 03-2003	null	2009	20	1
Bolusao Fish Sanctuary	Bolusao Lawaan Eastern Samar	BRGY. ORDINANCE IS ON PROCESS BUT A PO RESOLUTION NO. 01, SERIES OF 2013 WAS MADE AND LOBBIED TO THE BRGY. FOR ADOPTION	null	2009	20	1
Lout Offshore Reef Marine Sanctuary	Poblacion (Malapatan) Malapatan Sarangani	An Ordinance Establishing a Marine Sanctuary in the Offshore Reef of Lot, Barangay Poblacion, Municipal Waters of Malapatan, Province of Sarangani	null	2006	20	0
Baybay Lun Padidu Offshore Reef Marine Sanctuary	Lun Padidu Malapatan Sarangani	An Ordinance Establishing a Marine Sanctuary in the Offshore Reef of Baybay, Barangay Lun Padidu, Municipal Waters of Malapatan, Province of Sarangani	null	2006	20	0
Bacayawan Marine Protected Area	Bacayawan Dimataling Zamboanga Del Sur	Municipal Ordinance Barangay Ordinance No. 10. Series of 2006 (2010 Municipal MPA Ordinance for second reading), Resolution #202	null	2006	20	0
Bibilic Marine Sanctuary	Bibilik Dumalinao Zamboanga Del Sur	Municipal Ordinance M.O. No. 2003-02-186 Series of 2003	null	2003	20	0
Calatagan Mangrove Rehabilitation and Nursery Project	Balibago Calatagan Batangas	Calatagan Environmental Code 2009/ Barangay Ordinance



(two zones: near guardhouse and fishpond boundary)	Batangas Marine Protected Area And Bantay Dagat Network	2010	20	0
Macabug Fish Sanctuary	null Ormoc City Leyte	NA	null	2001	20	0
Hingotanan West Marine Sanctuary	null Bien Unido Bohol	Municipal Ordinance MO# 2000-21	null	2002	20	0
San Juan Fish Sanctuary	null Panukulan Quezon	Municipal Ordinance MO	null	2003	20	0
Cagsiay Fish Sanctuary	null Mauban Quezon	Municipal Ordinance MO	null	2005	20	0
Malingin Fish Sanctuary	Malingin Bien Unido Bohol	Municipal Ordinance MO# 2000-21, MO 2-2002	null	1994	20	0
Baod Fish Sanctuary	Baod Bantayan Cebu	Municipal Ordinance MO 08-1999	null	1999	20	0
Pasitagan Sulangon Marine Sanctuary	null Bantayan Cebu	Municipal Ordinance MO# 8-s-1999	null	1999	20	0
Brgy. Maono-Pausod Artificial Reef	null San Miguel Leyte	NA	null	0	20	0
Visayan State College of Agriculture Marine Sanctuary	null Baybay Leyte	NA	null	0	20	0
Bacungan Fish Sanctuary	null Pagbilao Quezon	NA	null	2002	20	0
Jagoliao Seagrass Marine Sanctuary	Jagoliao Jetafe Bohol	Municipal Ordinance No. 14 Series 2002;

Municipal Ordinance No. 08 Series 2003	null	2002	20	0
Pingan-Pingan Reef Fish Sanctuary	null Lupon Davao Oriental	NA	null	0	20	0
Bongalonan Marine Sanctuary	null Basay Negros Oriental	Municipal Ordinance Mun Ord 01-1985; Mun Ord 23-1993	null	1985	20	0
Tamiao Marine Sanctuary	Tamiao Bantayan Cebu	Municipal Ordinance Mun. Ord. 08-1999	null	1996	20	0
Capayas Island Marine Sanctuary	null Lopez Jaena Misamis Occidental	NA	null	2000	20	0
Unidad Rizal and Gamut, Barobo Fish Sanctuary	null null Surigao Del Sur	NA	null	0	20	0
Mandawa Fish Sanctuary	Mandawa Bien Unido Bohol	Municipal Ordinance MO# 2000-21, MO# 2-2002	null	2000	20	0
Libjo/Bucao Fish Sanctuary	null Polillo Quezon	Municipal Ordinance MO	null	2003	20	0
Pilar Fish Sanctuary	null Pilar Capiz	NA	null	1998	20	0
Sibolo Island Marine Sanctuary	null Caluya Antique	NA	null	1994	20	0
Katadungan Brgy. Punta Maria Fish Sanctuary and Marine Protected Area (prop)	null Borongan Eastern Samar	NA	null	0	20	0
Campao Occidental Marine Sanctuary	Campao Occidental Jetafe Bohol	Municipal Ordinance Mun Ord 08-2002	null	2002	20	0
Suba Marine Sanctuary	null Anda Bohol	Ordinance MO	null	2004	20	0
Pulong Wala Fish Sanctuary	null Perez Quezon	Municipal Ordinance MO	null	2002	20	0
Sulangan Marine Sanctuary	Sulangan Bantayan Cebu	Municipal Ordinance No. 08-1999;

Municipal Ordinance 07-1996	null	1996	20	0
Pamosaingan Marine Sanctuary	null Socorro Surigao Del Norte	Municipal Ordinance MO# 5	null	2000	20	0
Basud & Maanda Fish Sanctuary	null Leyte Leyte	Municipal Ordinance MO	null	0	20	0
Pandanon Fish Refuge and Sanctuary	Pandanon Jetafe Bohol	Municipal Ordinance No. 08 Series 1996;

Municipal Ordinance No. 08 Series 2002	null	2002	20	0
Bugsayon Marine Sanctuary	null null null	MO 052-03	null	2003	20	13
Rabaw Ti Bato	null null null	Municipal Ordinance No. 04 Series of 2014	null	2014	20	50
Rabaw Ti Bato	null null null	Municipal Ordinance No. 04 series of 2014	null	2014	20	50
Rabaw Ti Bato	null null null	Municipal Ordinance No. 04 Series of 2014	null	2014	20	50
Rabaw Ti Bato	null null null	Municipal Ordinance No. 04 series of 2014	null	2014	20	50
Dapia Marine Sanctuary	null Island Garden City of Samal Davao Del Norte	City Ordinance 2010-160	Davao Gulf Marine Protected Area Network Plan	2010	20.13	0
Belatan Halo Fish Sanctuary	null Panglima Sugala (Balimbing) Tawi Tawi	PS-09-007 S-2009	null	2009	20.17	0
Obo-ob Marine Protected Area	Obo-Ob Bantayan Cebu	NA	null	2004	20.38	12
Kabac Marine Sanctuary	null Bantayan Cebu	Municipal Ordinance Mun Ord  08-1999 (to be amended)	null	2006	20.48	0
Bantigue Fish Sanctuary	null Ormoc City Leyte	Municipal Ordinance Mun Ord  05-2003	null	2005	20.6	0
Virgen Marine Park and Sanctuary	Virgen Anda Bohol	NA	null	2016	20.6	10.7
Biga Fish Sanctuary and Refuge	Biga Lobo Batangas	Barangay Resolution No. 02-2002, Municipal Ordinance No. 2 series of 2002	Batangas Marine Protected Area And Bantay Dagat Network	2002	20.65	0
Anapog Fish Sanctuary	null San Remigio Cebu	Municipal Ordinance Mun Ord  32-2002	null	2002	20.8	0
Ungus-Ungus Marine Protected Area	Ungus-Ungus Bongao Tawi Tawi	Municipal Ordinance BR# 2-s-2007, MO# 167-s-2007	null	2007	20.9	0
Dugong Sanctuary	null Island Garden City of Samal Davao Del Norte	MO 2010-160	Davao Gulf Marine Protected Area Network Plan	2010	20.93	0
Merida Fish Sanctuary	null Merida Leyte	Municipal Ordinance MO. & BFAR. AO	null	0	21	0
Agdao Centro Fish Sanctuary	Agdao Davao City Davao Del Sur   / Centro (San Juan) Davao City Davao Del Sur	CO #375 s-2007	null	2007	21	0
Real Marine Sanctuary Dev't Project	null Daram Samar	NA	null	0	21	0
San Isidro Marine Sanctuary	San Isidro Magsaysay Misamis Oriental	Barangay Ordinance No. 11, Series of 2000; SB Resolution No. 32, Series of 2000	null	2000	21	0
Kandiis Marine Sanctuary	Candiis Magsaysay Misamis Oriental	Municipal Ordinance Resolution No. 97, Series of 2000, Barangay Ordinance Resolution No. 96, Series of 2000, Barangay Ordinance Resolution No. 2-3,	null	2000	21	0
Cagasawan Seagrass Sanctuary	Cagawasan Inabanga Bohol	Municipal Ordinance Mun Ord 00-21-2000	null	2000	21	0
Lain Marine Reserve and Fish Sanctuary	Taguite Lawaan Eastern Samar	Municipal Ordinance No. 01 series of 2001



Municipal Ordinance Mun Ord  4-1994; Mun Ord  02-1996	null	1996	21.1	1
Dumana Marine Sanctuary	Tahud Inopacan Leyte	Resolution Mun. Res. No. 134-1996; Ordinance No. 02, Series of 2005	null	1996	21.3	0
Olang Marine Protected Area	Olang Maria Siquijor	Municipal Ordinance Mun Ord No. 02-2002	null	2003	21.36	0
Bogo Marine Protected Area	Bogo Maria Siquijor	Municipal Ordinance Municipal Ordinance. (specific number not obtained)	null	2002	21.36	0
Imnajbu Marine Sanctuary	Imnajbu Uyugan Batanes	NA	null	0	21.525	0
Capandan Marine Protected Area	Capandan Cortes Surigao Del Sur	-	Lanuza Bay Development Alliance (LBDA)	2003	21.53	0
Mawi Marine Sanctuary	Mawi Duero Bohol	Municipal Ordinance Mun Ord  02-2003	null	2003	21.56	0
Municipal Fish Sanctuary	Capalong Real Quezon	Municipal Ordinance No. 010 Series of 2011	null	2011	21.6	0
Nueva Estrella Fish Sanctuary	Pamosaingan Socorro Surigao Del Norte	Municipal Ordinance No. 03 Series of 2003	null	2003	21.619	0
Masaguisi Fish Sanctuary	Masaguisi Bongabong Oriental Mindoro	Municipal Ordinance No.05-2012	null	2006	21.68	0
Hingotanan East Marine Sanctuary	Hingotanan East Bien Unido Bohol	Municipal Ordinance No. 2005-02;

Municipal Ordinance No. 2002-02	null	2002	21.7	0
Langkis Marine Sanctuary	Langkis Duero Bohol	Municipal Ordinance Mun Ord  02-2003	null	1999	21.79	0
Basco Community Marine Sanctuary	Chanarian Basco Batanes	Ordinance No. 2005-104	null	2005	21.85	0
Banbanon Fish Sanctuary	Banbanon San Francisco Surigao Del Norte	SB Ordinance #  99-059	null	1999	21.99	0
Talisay Marine Sanctuary	Malim Tabina Zamboanga Del Sur	Mun. Ordinance # 03-89/2003	null	2002	22	0
Tubajon MPA	Tubajon Laguindingan Misamis Oriental	Municipal Ordinance # 94 Series of 2002	null	2002	22	0
Liboron Seagrass Sanctuary	Liboron Calape Bohol	Municipal Ordinance Mun Ord  11-2003	null	1996	22	0
Semirara Island Marine Sanctuary	null Caluya Antique	NA	null	1998	22	0
Kaongkod Marine Sanctuary	null Madridejos Cebu	Municipal Ordinance No. 07-1996	null	1996	22	0
Combo Marine Sanctuary	null Labangan Zamboanga Del Sur	Municipal Ordinance BO#03-S 2006, Municipal Ordinance No. 200302 - 186	null	2006	22	0
Capitancillo, Bogo CEP	null Bogo Cebu	Municipal Ordinance Municipal Ordinance	null	2004	22	0
Liboganon MPA	Liboganon City of Tagum Davao Del Norte	CO # 249 s-2007	Davao Gulf Marine Protected Area Network Plan	2005	22	0
Santa Fish Sanctuary	Magsaysay District Santa Ilocos Sur	Resolution No. 35	null	2007	22	0
Taguite Fish Sanctuary	Taguite Lawaan Eastern Samar	Brgy. Resolution No. 03 1994, MFO No. 03 - 2003	null	1994	22.1	1
Taguite Marine Sanctuary	null Lawaan Eastern Samar	Municipal Ordinance MO, BR# 3-1994	null	1996	22.2	0
Bool Fish Sanctuary	Bool Tagbilaran City Bohol	Municipal Ordinance Municipal OrdinanceNo. C-075-2000	null	2000	22.2	0
Cabantian Marine Sanctuary	Cabantian Guindulman Bohol	Municipal Ordinance Mun Ord  02-2008;

Mun Ord  09-176-2003;

Mun. Res. No. 09-179,-2003; Brgy. Res. Mo. 08,-2003	null	2003	22.22	0
Mahayag Marine Reserve Area	null Villareal Samar	Municipal Ordinance Mun. Ord. (specific number not obtained)	null	2003	22.5	0
