complete_name	location	legislation	network	year_established	core_area_ha	buffer_area_ha
Gubat Marine Reserve and Fish Sanctuary	Rizal Gubat Sorsogon   / Bagacay Gubat Sorsogon	Municipal Ordinance No. 2012-003 (An ordinance establishing fish sanctuary at barangay Bagacay and Rizal, Gubat, Sorosogon, amending for the purpose section 2 & 3 of Article D, Chapter XI of the administrative code of the municipality of Gubat, Sorsogon.	null	2012	40	50
Limasawa Fish Sanctuary	San Agustin Limasawa Southern Leyte   / Lugsongan Limasawa Southern Leyte	NA	null	2008	40	0
Taytayen Etayo Marine Reserve	Papaya Nasugbu Batangas	Ordinance No. 23, Resolution No. 52 Series 2009	null	2009	40.49	0
Campalabo Reef	null Calatrava Negros Occidental	MO No. 12 s of 2010	Campalabo-San Isidro-Tinangisan Reef Complex MPA

EO No. 06 s of 2012	Creation of Municipal PAMB	null	2010	40.96	0
San Miguel Bay	null San Miguel Leyte	NA	null	0	41	0
Tenga Fish Sanctuary	null Narra Palawan	Municipal Ordinance No. 159, 2005	null	2005	41.0998	0
Silonay Mangrove Reserve	Silonay City of Calapan Oriental Mindoro	Resolution No. 390 City Ordinance No.10	null	2010	41.3	0
Puno Point Marine Reserve	null Guiuan Eastern Samar	NA	null	1994	41.4	0
Esperanza Marine Sanctuary	Esperanza Poro Cebu	Municipal Ordinance No. 3 Series of 2004	null	2004	42	1
Tapul Reef Fish Sanctuary	null Puerto Princesa City Palawan	NA	null	0	42	0
Hulao-hulao Fish Sanctuary	NA	Municipal Ordinance Mun. Ord. 2000-58	null	1996	42	32
Poblacion Fish Sanctuary	Poblacion (Carmen) Carmen Agusan del Norte	Municipal Fisheries Ordinance no.5 series of 2003	null	2003	42	0
Balabag Marine Sanctuary	null Cagayancillo Palawan	MO 01-2009	null	2009	42.04	0
Bani Mangrove Marine Protected Area	null Bani Pangasinan	Municipal Ordinance Municipal Ordinance No. 2001-01	null	2001	42.25	0
Takot Siari MPA	null Talusan Zamboanga Sibugay	NA	null	2003	42.5	0
Nakanmuan Marine Sanctuary	Nakanmuan Sabtang Batanes	NA	null	0	42.626	0
Mabahin Fish Sanctuary	Mabahin Cortes Surigao Del Sur	Municipal Ordinance MO# 15-97	Lanuza Bay Development Alliance (LBDA)	1997	42.8498	0
Uba  Marine Protected Area	Uba Cortes Surigao Del Sur	Municipal Ordinance MO# 05-s-2005

Municipal Ordinance No. 2 series of 2006	Lanuza Bay Development Alliance (LBDA)	2005	43	0
Batong Buhay Marine Sanctuary	null Mabini Batangas	MO 05-2010	null	2009	43	0
Sitangkai North Lagoon Marine Protected Area	Tongmageng Sitangakai Tawi Tawi   / North Larap Sitangakai Tawi Tawi   / South Larap Sitangakai Tawi Tawi   / null Sitangakai Tawi Tawi	ORDINANCE NO. 06-069 SITANGKAI MARINE PROTECTED AREA ORDINANCE OF 2006	null	2006	43.17	0
Tinagong Dagat Marine Protected Area	null Narra Palawan	MO #159 Series of 2005	null	2005	43.25819	0
Lomboy-Kahayag Fish Sanctuary	Lomboy Calape Bohol   / Kahayag Calape Bohol	Municipal Ordinance Mun Ord 14-2003; Mun Ord 11-1995 amended 2001; RA 7686	null	1999	43.28	0
Lobo Mangrove Forest Conservation Area	null Lobo Batangas	RA 8550/for approval of SB	Batangas Marine Protected Area And Bantay Dagat Network	2001	43.54	0
Kagana Marine Protected Area	Ganayon Lianga Surigao Del Sur	Municipal Resolution No. 127 - 01; BDC Resolution No. 1, Series of 2001	null	2001	43.6	78.94
Capasuan Vatang-Charakuhan Marine Sanctuary	San Vicente (Igang) Ivana Batanes	aaa	null	0	43.745	0
Kamanga Marine Ecotourism Park and Sanctuary	Tinoto Maasim Sarangani   / Kamanga Maasim Sarangani	An Ordinance Establishing a Marine Ecotourism Park and Sanctuary in Barangay Kamanga, Municipal Waters of Maasim, Province of Sarangani (Ordinance No. 06-020)	null	2006	43.85	0
Tanghaligue Marine Sanctuary	Tanghaligue Talibon Bohol	Municipal Ordinance Mun Ord 91-2000	null	2000	43.9	0
Tondon Fish Sanctuary	null Panglima Sugala (Balimbing) Tawi Tawi	Municipal Ordinance BR# 1-s-2007, MO# 07-001	null	2007	43.97	0
Monbon Fish Sanctuary	Barangay Poblacion 6 Lawaan Eastern Samar   / Barangay Poblacion 2 Lawaan Eastern Samar	Municipal ordinance no. 02 series of 1996   Municipal ordinance no. 04 series of 1994	null	1995	44.1	1
Bagasawe Marine Reserve & Fish Sanctuary	null Tuburan Cebu	Municipal Ordinance Municipal Ordinance (not specified) Municipal Fisheries Ordinance No. 041-1999; Pres. Proc. No. 123	null	2002	44.21	0
Sanktuwaryo Sancedaco Marine Protected Area	null Bani Pangasinan	Municipal Ordinance Municipal Ordinance No. 01-2004	null	2004	44.3	0
Poro Marine Protected Area	Poro San Fernando City (Capital) La Union	An Ordinance Establishing a Marine Protected Area (MPA) in Barangay Poro, Creating Its Management Council and Providing for Its Management Plan.



(Legislation not yet passed as of May20,2015)	null	2014	44.42	0
Bilang-Bilangan East Marine Sanctuary	Bilangbilangan Diot Bien Unido Bohol	Mun Ord No. 2005-08;

Mun Ord No. 2002-02	null	2000	44.8	0
Doh Tong Marine Protected Area	Doh-Tong Simunul Tawi Tawi	Municipal Ordinance MO# 05-09	null	2005	44.89	0
Tanza Fish Sanctuary	Julugan III Tanza Cavite   / Julugan I Tanza Cavite	Municipal Ordinance No.10-2009	null	2009	45	0
Dos Hermanas Is. Marine Park/Reserve	null Corcuera Romblon	NA	null	0	45	0
Cambatong Fish Sanctuary	Cambatong Hinatuan Surigao Del Sur	Barangay Ordinance BO# 09, VM 157	null	1998	45	0
San Isidro Labrador Fish Sanctuary	Buhay na Tubig Pola Oriental Mindoro	Municipal Ordinance No. 2016-01	null	2016	45	0
Bahurang Tapat Fishery Reserve	Talaotao Looc Occidental Mindoro	Joint Municipal Ordinance No 1. Series of 2010	null	2010	45.17144	0
Ikaduha or Pangaduha Reef FS	null Magdiwang Romblon	NA	null	2002	45.36	0
Minara Marine Protected Area	null null null	MO 489 s2014



with mangrove, seagrass zone	null	2014	45.82	658.04
Mantalip Marine Reserve	null Bindoy Negros Oriental	MO # 7, series of 2003, 

Amended MO # 1, series of 2009, Resolution # 27, s 2009	null	2007	46	0
Tagbacong Reef Fish Sanctuary	null Puerto Princesa City Palawan	Barangay Ordinance Bgy. Ordinance No. 03	null	0	46.07	0
Bacacay MFR	null Bacacay Albay	NA	null	2006	46.25	0
Binubusan Marine Protected Area	Binubusan Lian Batangas	Brgy. Ord. / for approval of SB

Municipal Ordinance No. 06, Series of 2015	Batangas Marine Protected Area And Bantay Dagat Network	2015	47.457	0
Biasong Fish Sanctuary	Biasong Hinunangan Southern Leyte	Municipal Ordinance No. 2003-340	null	2003	47.5	0
Mabudo Fish Sanctuary	Dibaraybay Dinalungan Aurora	Municipal Ordinance 2002-119	null	2002	48	1
Mulanay Fish Sanctuary	null Mulanay Quezon	Municipal Ordinance MO	null	2005	48	0
Rawis Reef Marine Sanctuary	null Puerto Princesa City Palawan	Municipal Ordinance Ordinance No. 422: An Ordinance Declaring the Rawis Reef located at Bgy. San Manuel, Puerto Princesa City as Marine Sanctuary.	null	2009	48	0
Bakong Ibaba Fish Sanctuary	null General Luna Quezon	Municipal Ordinance MO	null	2001	48	0
Puntod Ilis Fish Sanctuary (Babuyan)	null Puerto Princesa City Palawan	Municipal Ordinance Ordinance No. 222: An Ordinance Establishing Puntod Ilis in Bgy. Babuyan, City of Puerto Princesa as a Marine Sanctuary	null	2003	48	0
Budiong FS	null Odiongan Romblon	NA	null	2000	48	0
Bulanit Marine Protected Area	null Labangan Zamboanga Del Sur	Municipal Ordinance Municipal Ordinance  No. 200302 - 186	null	2006	48	0
San Pedro Marine Protected Area	San Pedro Cantilan Surigao Del Sur	-	Lanuza Bay Development Alliance (LBDA)	2005	48	95
Panacalan MPA	Macaleeng Anda Pangasinan   / null Anda Pangasinan	Municipal Ordinance # 03-2002	null	2002	48.59	0
Cagban Marine Fish Sanctuary	Ipil Gigaquit Surigao Del Norte	Municipal Order #30 Series of 2002

An ordinance establishing MFS in the municipal	null	2002	48.77	0
Brgy. Cogon Punta Biao Fish Sanctuary	null Digos Davao Del Sur	Municipal Ordinance MO	Davao Gulf Marine Protected Area Network Plan	2004	49	0
Bato Tabao Coral Reef Fishery Refuge and Sanctuary	Concepcion Calintaan Occidental Mindoro	Municipal Ordinance No. 01 S-2001	null	2011	49	0
St. John the Baptist Fish Sanctuary	Puting Cacao Pola Oriental Mindoro	Municipal Ordinance No. 10-12	null	2010	49.38	0
Brgy Lumaniag Marine Protected Area	Lumaniag Lian Batangas	Brgy. Ord. / for approval of SB	Batangas Marine Protected Area And Bantay Dagat Network	2011	49.92	0
Baler Marine Protected Area	Zabali Baler Aurora	Municipal Ordinance DO8 Series of 2006	null	2006	50	50
Julien's Wreck Marine Reserve and Sanctuary	Cartagena Sipalay Negros Occidental	C.O. NO. 2012 - 004	null	2013	50	0
Catmon Marine Protected Area	Catmon San Juan Batangas	MO 01-2010, amended Municipal Ordinance No. 07-2006 / RA 8550	null	2000	50	0
Putingbuhangin Marine Protected Area	Putingbuhangin San Juan Batangas	MO 01-2010, amended Municipal Ordinance No. 07-2006 / RA 8550	null	2000	50	0
Catmon Mangrove Protected Area	Catmon San Juan Batangas	MO 07-2006 / RA 8550	null	2000	50	0
Imelda Mangrove Protected Area	Imelda (Tubog) San Juan Batangas	MO 07-2006 / RA 8550	null	2000	50	0
Hagonoy Fish Sanctuary	null Hagonoy Davao Del Sur	NA	null	1998	50	0
Bolinao Reefs and Santiago/Silaqui Is. Marine Park/Reserve	null Bolinao Pangasinan	NA	null	0	50	0
Catanauan Fish Sanctuary	null Catanauan Quezon	Admin Order BFAR AO	null	0	50	0
Tuban-Tagabuli Fish Sanctuary	Tagabuli Santa Cruz Davao Del Sur   / Tuban Santa Cruz Davao Del Sur	-	null	2005	50	0
Triton Island Fish Sanctuary	null Vincenzo A. Sagun Zamboanga Del Sur	Municipal Ordinance MO# 05-96	null	1996	50	0
Eastern Cabul-an Marine Sanctuary	null Buenavista Bohol	Municipal Ordinance MO# C-004-s-2002, Art.IV, Sec.17	null	2002	50	0
Banacon Island Marine Sanctuary	Banacon Jetafe Bohol	Municipal Ordinance Mun Ord 8-2002	null	2002	50	0
Prape Fish Sanctuary	null Padada Davao Del Sur	Municipal Ordinance MO# 6	Davao Gulf Marine Protected Area Network Plan	1993	50	0
Libaong (Handumon) Marine Sanctuary	Handumon Jetafe Bohol	Barangay Ordinance No,15, series of 1995;Municipal Ordinance No.04 series of 1998	null	1995	50	0
La Fraternidad Tubay Fish Sanctuary	null Butuan City Agusan del Norte	Resolution SB Res 143-A	null	0	50	0
Anajao Island Fish Sanctuary	null Sulat Eastern Samar	NA	null	1994	50	0
Olotayan Island Marine Sanctuary	Olotayan Roxas City Capiz	Municipal Ordinance City Ord. No. 2007-016 amended from Ord. 104-2002	null	2002	50	182
Artificial Reef, Fish Reservoir & Reforestation	null Batad Iloilo	Municipal Ordinance MO# 3, 4, 5 & 8	null	0	50	0
Mayao Castillo Fish Sanctuary	null Lucena City Quezon	Municipal Ordinance MO	null	2003	50	0
Arew and San Isidro Marine Sanctuary	null Cabangan Zambales	NA	null	0	50	0
Layangan Fish Sanctuary	null Vincenzo A. Sagun Zamboanga Del Sur	NA	null	0	50	0
Malalag Fish Sanctuary	null Malalag Davao Del Sur	NA	Davao Gulf Marine Protected Area Network Plan	1993	50	0
Waling-waling Fish Sanctuary	null Vincenzo A. Sagun Zamboanga Del Sur	NA	null	0	50	0
Buburay Marine Protected Area	null Dimataling Zamboanga Del Sur	NA	null	2005	50	0
Sayucao Fish Sanctuary	null Vincenzo A. Sagun Zamboanga Del Sur	NA	null	0	50	0
Western Cabul-an Marine Sanctuary	null Buenavista Bohol	Municipal Ordinance Mun Ord  2000-07-167-2000	null	2000	50	0
Kapigtaan Masao Fish Sanctuary	null Butuan City Agusan del Norte	Resolution SB Res 644-1996	null	0	50	0
Dimalooc Cove Fish Sanctuary	null Tangub City Misamis Occidental	Admin Order BFAR AO	null	0	50	0
Sitio Magom Macambol Mati Fish Sanctuary	null Mati Davao Oriental	NA	null	0	50	0
Nagolon Island Fish Sanctuary	null San Vicente Palawan	NA	null	1997	50	0
Puntod Reef MPA	null Roxas Palawan	NA	null	2004	50	0
Seco Island Marine Sanctuary	null Tibiao Antique	Municipal Ordinance Mun Ord 93-01	null	1993	50	0
Estaca Mangrove/Fish Sanctuary	null Compostela Cebu	NA	null	0	50	0
Balasinon Fish Sanctuary	null Sulop Davao Del Sur	NA	Davao Gulf Marine Protected Area Network Plan	1997	50	0
Liangan Cove Fish Sanctuary	null Vincenzo A. Sagun Zamboanga Del Sur	Municipal Ordinance MO# 10	null	1993	50	0
Agay-ayan and Caloco Marine Sanctuaries	Agay-Ayan Tinambac Camarines Sur   / Caloco Tinambac Camarines Sur	Municipal Ordinance No. 05 Series of 2006	null	2006	50	48
Asinan Fish Sanctuary	Asinan Buenavista Bohol	Municipal Ordinance No. C-004 Series 2002;

Municipal Ordinance No. 07 series of 2005	null	2000	50	0
Batulaki Marine Protected Area	Batulaki Glan Sarangani	Mun. Ordinance 2000-02; Glan Coastal and Fishery Resources Management Ordinance of 2000, Ordinance No. 2000-04	null	2000	50.64	0
Palo Fish Sanctuary	null Bato Camarines Sur	NA	null	2001	51	0
Brgy. Tuban Marine Protected Areas	null Island Garden City of Samal Davao Del Norte	NA	null	2007	51.5	0
Buenavista Community Marine Protected Area	Yook Buenavista Marinduque	MO 143-2013

MO #159 S of 2014	null	2013	51.521	92.161
San Isidro Marine Sanctuary	San Isidro Calape Bohol	NA	null	2003	51.56	0
Canticlan Island (Pearl Island) Guiuan	null Guiuan Eastern Samar	Municipal Fisheries Ordinance No. 02, Series of 1998	null	1998	52	1
Aguining Fish Sanctuary	Aguining Pres. Carlos P. Garcia Bohol	Municipal Ordinance Municipal Ordinance C-001 No. 5-1986	null	1993	52	0
Siete Pecados Marine Park	Tagumpay Coron Palawan	Municipal Ordinance No. 7-A-2005 & amended Municipal Ordinance No. 8-A-2007	null	2005	52	0
Batu-Batu-Kulape MPA	Kulape Panglima Sugala (Balimbing) Tawi Tawi   / Batu-Batu Panglima Sugala (Balimbing) Tawi Tawi	Municipal Ordinance MO# PS-03-s-2005	null	2005	52.33	0
Sebaste Shoal Marine Sanctuary	Poblacion Sebaste Antique	Ordinance No. 04 -2000	null	2000	52.43	1
Matabao Marine Sanctuary	Matabao Tubigon Bohol	Barangay Ordinance No. 1-2011

SB Resolution No. 2001-173	null	2011	52.6	15
Matabao Fish Sanctuary	null null null	Brgy. Ord. # 1 of 2011, Mun. Res. #: 2011-173	null	2011	52.6	0
Manda Island Marine Protected Area	null n.a. ( 41426) Tawi Tawi	MUNICIPAL ORDINANCE NO. 001 MANDA ISLAND MARINE PROTECTED AREA 2007	null	2007	52.61	0
Cutad - Pico de Loro Marine Reserve	Papaya Nasugbu Batangas	Ordinance No. 23, Resolution No. 52 Series 2009	null	2009	52.62	0
Apalan Marine Reserve & Fish Sanctuary	null Tuburan Cebu	Municipal Ordinance Municipal Ordinance (not specified)	null	2000	53	0
Kayreyna Marine Protected Area	Lumaniag Lian Batangas	Municipal Ordinance No. 05, Series of 2015	Batangas Marine Protected Area And Bantay Dagat Network	2015	53.057	0
Tuka Marine Park, Reserve and Sanctuary	null Kiamba Sarangani	An Ordinance for the Utilization, Development, Conservation, Protection and Management of Fisheries and Aquatic Resources in the Municipality of Kiamba, Sarangani Province and for Other Purposes/Municipal Ordinance No. 06-084; Municipal Ordinance MO# 2005-82	null	2006	53.305	0
Pilar Island Fish Sanctuary No. 1	null Santo Nino Samar	Municipal Ordinance Mun. Ord. (specific number not obtained)	null	0	54	0
Capinahan Marine Sanctuary	null Bais City Negros Oriental	MO No. s of 2015	Capinahan Marine Ordinance 

MO No. s of 2007	Coastal Zoning Ordinance	null	2014	54.01	0
Mitri Community-Managed Marine Area	Buena Suerte Pob. (Barangay 2) El Nido (Bacuit) Palawan	MO 2009-01	null	2009	54.6	0
Bonbon Marine Sanctuary	null Aloguinsan Cebu	MO No. 02 s of 2005	Marine Sanctuary Regulations Ordinance

MO No. 01 s of 2005	MPA Ordinance

MO No. 01 s of 2013	Bonbon Marine Sanctuary Ordinance

MO No. 02 s of 1999	Coastal and Fisheries Management Ordinance	null	2013	54.7	0
Pagudpud (Pimmaga) Fish Sanctuary	Pasaleng Pagudpud Ilocos Norte	MO # Establishing the Pagudpud Fish Sanctuaries	null	2008	54.86	0
Sta. Cruz Community Marine Reserve	Kalangkang Santa Cruz Marinduque   / Kasily Santa Cruz Marinduque	MO #45 S of 2008	null	2008	55.128	139.78
Tigao Fish Sanctuary	Tigao Cortes Surigao Del Sur	Municipal Ordinance No. 17-96	Lanuza Bay Development Alliance (LBDA)	1996	55.31	0
Oroquieta City Marine Sanctuary	null null Misamis Occidental	NA	null	1999	56	0
Barangay Dolores Marine Fish Haven	null null null	Municipal Ordinance 2-2014	null	2014	56.51	0
Carabao Island Fish Sanctuary	null null Cavite	Ordinance No. 74-S-2004	null	2015	56.8	0
Dibutunan Marine Protected Area	Dibutunan Dipaculao Aurora	Ordinance No.2006-02	null	2006	57.71	0
Lanuza Marine Park and Sanctuary	Sibahay Lanuza Surigao Del Sur   / null Lanuza Surigao Del Sur	Municipal Ordinance No. 122, Series of 1999	Lanuza Bay Development Alliance (LBDA)	2002	58	0
Dao Dao Island Marine Protected Area	null Pagadian City Zamboanga Del Sur	Municipal Ordinance Municipal Ordinance 2007 - 260	null	2007	58	0
Mahanay Marine Sanctuary	Mahanay (Mahanay Island) Jetafe Bohol	Municipal Ordinance Mun Ord  (not specified)	null	1997	59	0
Naic Fish Sanctuary	null null Cavite   / Mabolo Naic Cavite   / Bucana Malaki Naic Cavite	SB Resolution No. 03 Series of 2003	null	2003	59.3	0
Tu-balan Cove	null Malita Davao Del Sur	NA	Davao Gulf Marine Protected Area Network Plan	2003	60	0
Lapinig Island Fish Sanctuary	Lapinig Pres. Carlos P. Garcia Bohol	Municipal Ordinance C-001 No. 05, Series of 1986, Municipal Ordinance C-002, Series of 1986, Municipal Ordinance No. 06, Series of 2000	null	1986	60	0
Kalaparan Coral Reef Protected Area	null Tobias Fornier Antique	Municipal Ordinance Mun. Ord. 24-2002	null	2002	60	0
Bolinao Seagrass Reserve	null Bolinao Pangasinan	Municipal Ordinance Municipal Fisheries Ordinance No. 1 series of 2007	null	2007	60	0
Bagsak, Central Fish Sanctuary	null null Davao Oriental	NA	null	0	60	0
Pandan Grande Sanctuary	Buenavista Sablayan Occidental Mindoro	General Ordinance 03-2008	null	2008	60	0
Calatagan Pyramid Artificial Reef Marine Protected Area	Bagong Silang Calatagan Batangas	Calatagan Environmental Code 2009/ Barangay Ordinance	Batangas Marine Protected Area And Bantay Dagat Network	2000	60.03	0
Pasadena Community-Managed Marine Area	Pasadena El Nido (Bacuit) Palawan	Mun. Ordinance No. 002 series 2008 ""An Ordinance Establishing the Cagbatang Marine Protected Area Located at Barangay Pasadea, Municipality of El Nido, Palawan""	null	2008	60.6	0
Song of the Sea Fish Sanctuary	Misong Pola Oriental Mindoro	Municipal Ordinance No. 2014-06	null	2013	60.61	0
Corong-Corong Reef Fish Sanctuary	null Puerto Princesa City Palawan	Municipal Ordinance Ordinance No. 447: An Ordinance Declaring Sixty Point Zero Nine (60.09) Hectares of Corong-Corong Reef Situated at bgy. Bagong Bayan, Puerto Princesa City, as Fish sanctuary.	null	2010	60.9	0
Roseller T. Lim Marine Protected Area	Magsaysay Roseller Lim Zamboanga Sibugay	Mun Or. 01-06-06	null	2006	62	50
Municipal Fishery Reserve and Sanctuary of Tigaon	Huyonhuyon Tigaon Camarines Sur   / Casuna Tigaon Camarines Sur	Municipal Ordinance 004, series of 2010	null	2010	62.2	0
San Jose Artificial Reef Project	null Tacloban City Leyte	Resolution BR	null	0	63	0
Buluan Island Marine Sanctuary	Bulu-An Ipil Zamboanga Sibugay	Municipal Ordinance 09-214-2006	null	2006	63.16	20
Kaeyoy Marine Protected Area	Palilan Jimenez Misamis Occidental	Municipal Ordinance	null	2002	63.2	0
Loyola Fish Sanctuary	null Hinatuan Surigao Del Sur	Barangay Ordinance BO# 12	null	1999	63.5	0
Maloong Canal Shoal MPA	Tumakid Lamitan Basilan   / Luksumbang Lamitan Basilan   / Malo-Ong Canal Lamitan Basilan	An Ordinance establishing the Maloong Canal Shoal Marine Protected Area of Fish Sanctuary Area within the municipal waters of Barangays Maloong Canal, Tumakid, and Luksubang providing for the management, conservation, development and protection thereof, appropriating funds thereof, and other purposes.	null	2007	64	144
Bintuan Sangat Marine Park	null Coron Palawan	NA	null	2004	64	0
Bani Marine Protected Area	Bani Masinloc Zambales	NA	null	2006	64.43	0
Pandan No Take Zone	Calutcot Burdeos Quezon	Municipal Resolution No. 035 Series of 2007	null	2007	64.5	0
Campomanes-Ballo Marine Reserve and Sanctuary	Barangay 4 Sipalay Negros Occidental   / Maricalum Sipalay Negros Occidental	City ordinance no. 2004-006 as ammended by C.O. No. 2012-004	null	2013	66	1
Palm Reef Marine Reserve and Sanctuary	Po-Ok Hinoba-An Negros Occidental	Municipal ordinance No. 2003-006	null	2003	66	0
Burgos Reef Sanctuary	Burgos Sablayan Occidental Mindoro	General Ordinance 03-2008	null	2008	67.68	0
Sta. Cruz Seagrass Sanctuary	null Calape Bohol	Municipal Ordinance MO# 07-s-2003	null	2003	67.72	0
Lagasan-Pababag Marine Protected Area	Pababag Bongao Tawi Tawi   / Lagasan Bongao Tawi Tawi	Municipal Ordinance MO# 163-s-2005	null	2005	68.79	0
Villahermosa Marine Sanctuary	Villahermosa Tudela Cebu	Municipal Ordinance MO# 2-2004	null	2004	69.3	0
Dapdap Esperanza Marine Sanctuary and Mangrove Reserve	Esperanza Pilar Cebu   / Dapdap Pilar Cebu	Municipal Ordinance No. 10, Series of 2012	null	2012	70	0
Lacson Reef Marine Sanctuary	null Puerto Princesa City Palawan	Municipal Ordinance Ordinance No. 345: An Ordinance Declaring the Coastal and Marine Bays of the Lacson Reef, Located at Honda Bay, Bgy. Tanabag, Puerto Princesa City, as Marine Sanctuary	null	2007	70	0
Adlay Marine Protected Area	Adlay Carrascal Surigao Del Sur	Municipal Ordinance No. 7, 2006	Lanuza Bay Development Alliance (LBDA)	2006	70	0
San Juan (Pagpisotan) Fish Sanctuary	San Juan Hinatuan Surigao Del Sur	Barangay Ordinance No. 11, Series of 1999, SB Resolution No. VM-172, SP Resolution No. 180, Series of 2004	null	1997	70	0
Misom Sanctuary	null Baliangao Misamis Occidental	NA	null	0	70	0
Carrascal Marine Protected Area	Caglayag Carrascal Surigao Del Sur	Municipal Ordinance No.9, 2005	Lanuza Bay Development Alliance (LBDA)	1999	70	0
Shellfish Reservation Zone	null Roxas City Capiz	Municipal Ordinance # 016 - 2007 amended	null	2002	70	0
Lumbal Fish Sanctuary	null Vincenzo A. Sagun Zamboanga Del Sur	NA	null	0	70	0
Badiang Fish Sanctuary	Badiang Anda Bohol	Municipal Ordinance Municipal Ordinance (specific number not obtained)	null	1999	70	0
Ipil Marine Reserve Area/ Fish Sanctuary	null Ormoc City Leyte	Municipal Ordinance Mun. Ord. 03-01	null	2005	70.2	0
Atulayan Bay Fish Sanctuary and Marine Reserve (Site I)	Atulayan Sagnay Camarines Sur	Municipal Ordinance 001, series of 1993

ammended 2013	null	1993	70.36	72.28
Pangyan Marine Protected Area	null Glan Sarangani	Mun. Ordinance 2000-02; Glan Coastal and Fishery Resources Management Ordinance of 2000, Ordinance No. 2000-04	null	2000	70.41	0
Tres Marias Marine Sanctuary	Bebeladan El Nido (Bacuit) Palawan	Municipal Ordinance Mun. Ordinance No. 001 series of 2007 ""An Ordinance Establishing Tres Marias Marine Sanctuary in the Municipality of El Nido, Palawan""	null	2007	70.8	0
Caretunan-Quilitisan Joint MPA	Carretunan Calatagan Batangas   / Quilitisan Calatagan Batangas	Calatagan Environmental Code 2009/ Barangay Ordinance	Batangas Marine Protected Area And Bantay Dagat Network	2000	71	0
Humay-humay Marine Sanctuary	Humayhumay Ubay Bohol	Municipal Ordinance Mun Ord  07-2006	null	0	71.2	0
Bilang-Bilangan West (Daku)	null Bien Unido Bohol	Municipal Ordinance MO# 2000-21, Mun Ord  02-2002	null	2000	71.9	0
Atulayan Island Fish Sanctuary (Site II)	null Sagnay Camarines Sur	Admin Order BFAR AO	null	1993	72	0
Baruarte-Bataan-Nagsaulay-Subukin Mangrove Protected Area	Subukin San Juan Batangas   / Bataan San Juan Batangas   / Barualte San Juan Batangas   / Nagsaulay San Juan Batangas	MO 01-2010, amended Municipal Ordinance No. 07-2006 / RA 8550	null	2000	73	0
Ticalan Marine Protected Area	Ticalan San Juan Batangas	MO 01-2010, amended Municipal Ordinance No. 07-2006 / RA 8550	null	2000	73	0
Badung-Badung Island Marabut (Western) Fish Sanctuary	null null Leyte	Admin Order BFAR AO	null	0	73	0
Parunponon Island Fish Sanctuary (Manalo)	null Puerto Princesa City Palawan	Municipal Ordinance Ordinance No. 144: An Ordinance Declaring seventy Four (74) Hectares West of Parunponon Island, Located at Honda Bay, bgy. Manalo, This City, as Fish Sanctuary.	null	2000	74	0
Badung-badong Fish Sanctuary	null Marabut Samar	Municipal Ordinance Mun. Res. No. 49-A-1992	null	1992	74	0
Atop-Atop Marine Sanctuary	Atop-Atop Bantayan Cebu	Municipal Ordinance Mun. Ord No. 11-1996;	null	1996	74.22	0
Looc Fish Sanctuary	null Almeria Biliran	Municipal Ordinance MO# 18	null	2009	74.4	0
Macrohon - Santa Cruz Marine Park Bird and Fish Sanctuary	Molopolo Macrohon Southern Leyte   / Santa Cruz Macrohon Southern Leyte	Municipal Ordinance No. 1996-228	null	1996	74.96	37.32
Calucub 1st Marine Protected Area	Calubcub I San Juan Batangas	MO 01-2010, amended Municipal Ordinance No. 07-2006 / RA 8550	null	2000	75	0
Lorong Panay Fish Sanctuary	null Panganiban Catanduanes	NA	null	0	75	0
Danan Fish Sanctuary	null Vincenzo A. Sagun Zamboanga Del Sur	NA	null	0	75	0
Lunib Fish Sanctuary	null Vincenzo A. Sagun Zamboanga Del Sur	NA	null	0	75	0
Dimataling Municipal Marine Protected Area	null Dimataling Zamboanga Del Sur	Municipal Ordinance IBRA 9 Unified Ordinance # 1	null	2006	75	0
Burgos Bird and Fish Sanctuary	Burgos Cortes Surigao Del Sur	Municipal Ordinance No. 2 series of 2006	Lanuza Bay Development Alliance (LBDA)	1998	75.6	0
Dabong Island Fish Sanctuary	null Santa Margarita Samar	Municipal Ordinance Mun. Ord. (specific number not obtained)	null	2005	75.622	0
Banilad Fish Sanctuary	Banilad Dumaguete City Negros Oriental	Resolution Brgy. Res. (no specific number available)	null	2011	76	0
Buloc-buloc Cove Marine Protected Area	Montemayor Naujan Oriental Mindoro	Municipal Ordinance at SB (Final Reading; currently being updated as of February 2017)	Oriental Mindoro Marine Protected Area And Fishery Law Enforcement Network (Ommpafle Network)	2016	77	0
San Miguel Marine Protected Area	San Miguel Linapacan Palawan	MO 14, S 2003	null	2003	77	622
Pandan Piqueno Sanctuary	Buenavista Sablayan Occidental Mindoro	General Ordinance 03-2008	null	2008	78	0
Cawili Bird and Marine Sanctuary	null Cagayancillo Palawan	Municipal Ordinance Municipal Ordinance No, 01-2009	null	2004	78.81	0
Abung Marine Protected Area	Abung San Juan Batangas	MO 01-2010, amended Municipal Ordinance No. 07-2006 / RA 8550	null	2006	80	0
Mahabang Buhangin Cove Fish Sanctuary and Refuge	Tubili Paluan Occidental Mindoro	Municipal Ordinance No. 10 S-2011	null	2011	80	486.2
Discovery Reef	Ligaya Sablayan Occidental Mindoro	General Ordinance 03-2008	null	2008	80	0
Brgy. Rizal Marine Protected Area	null null null	Barangay Resolution No. 3 S of 2007

MO No. 339 S2007



with Coral Reef 2	null	2007	80	1333
